{
  "repo": {
    "url": "https://github.com/jjayarajdev/customMistral.git",
    "branch": "main",
    "path_filters": ["src/**", "infra/**", "docs/**"],
    "monorepo": true
  },
  "requirement": {
    "summary": "Add multi-tenant support",
    "type": "feature",
    "drivers": ["B2B contracts", "Market expansion", "Enterprise customers"],
    "acceptance_criteria": [
      "Tenant isolation at data + config layers",
      "RBAC for tenant admin",
      "Zero downtime migration",
      "Tenant-specific customization",
      "Usage tracking per tenant"
    ],
    "non_functional": {
      "security": ["RLS", "PII isolation", "Encryption at rest"],
      "performance": {
        "p95_ms": 300,
        "concurrency": 2000
      },
      "availability_slo": "99.9%"
    },
    "constraints": ["Keep Postgres", "No breaking API v1", "Reuse existing auth"],
    "deadline": "2025-10-15"
  },
  "context": {
    "target_envs": ["dev", "staging", "prod"],
    "architecture_style": "modular monolith",
    "domain_owners": ["platform", "auth", "billing"],
    "compliance": ["SOC2", "GDPR"],
    "cloud": "Azure",
    "ci_cd": "GitHub Actions",
    "risk_tolerance": "medium"
  },
  "documentation": {
    "roots": ["docs/", "/wiki/export", "/adr"],
    "formats": ["md", "adr", "openapi", "plantuml", "mermaid"],
    "primary_diagram_style": "C4"
  },
  "analysis_scope": {
    "code_depth": "standard",
    "history_window": "90d",
    "include_open_prs": true,
    "include_issues_labels": ["architecture", "breaking-change"]
  },
  "outputs": {
    "deliverables": [
      "Requirement Summary",
      "Impacted Components",
      "Impact Analysis",
      "Updated Architecture (C4 L2/L3)",
      "ADRs",
      "Risks & Mitigations",
      "Effort & Plan",
      "Test Strategy",
      "Change Log draft"
    ],
    "format": ["md", "png"],
    "repo_write_back": {
      "pull_request": true,
      "pr_branch": "feat/ea-analysis-multi-tenancy"
    }
  }
}